<?xml version="1.0" encoding="UTF-8"?>
<xs:schema xmlns:xs="http://www.w3.org/2001/XMLSchema" xmlns:jxb="http://java.sun.com/xml/ns/jaxb" jxb:version="2.1">
    <xs:include schemaLocation="../../global_types.xsd"/>
    <xs:element name="landing_special">
        <xs:complexType>
            <xs:sequence>
                <xs:element name="landing_special_location" type="LandingSpecial" minOccurs="0" maxOccurs="unbounded"/>
            </xs:sequence>
        </xs:complexType>
    </xs:element>
    <xs:complexType name="LandingSpecial">
        <xs:attribute name="id" type="xs:int" use="required"/>
        <xs:attribute name="name" type="xs:string" use="required"/>
        <xs:attribute name="race" type="xs:string" use="required"/>
    </xs:complexType>
</xs:schema>